Sheet: Sheet1
A1: 0 | B1: =SIN(RC[-1] * PI() / 180) -> 0
A2: =R[-1]C+5 -> 5 | B2: =SIN(RC[-1] * PI() / 180) -> 8.7155742747658166E-2
A3: =R[-1]C+5 -> 10 | B3: =SIN(RC[-1] * PI() / 180) -> 0.17364817766693033
A4: =R[-1]C+5 -> 15 | B4: =SIN(RC[-1] * PI() / 180) -> 0.25881904510252074
A5: =R[-1]C+5 -> 20 | B5: =SIN(RC[-1] * PI() / 180) -> 0.34202014332566871
A6: =R[-1]C+5 -> 25 | B6: =SIN(RC[-1] * PI() / 180) -> 0.42261826174069944
A7: =R[-1]C+5 -> 30 | B7: =SIN(RC[-1] * PI() / 180) -> 0.49999999999999994
A8: =R[-1]C+5 -> 35 | B8: =SIN(RC[-1] * PI() / 180) -> 0.57357643635104605
A9: =R[-1]C+5 -> 40 | B9: =SIN(RC[-1] * PI() / 180) -> 0.64278760968653925
A10: =R[-1]C+5 -> 45 | B10: =SIN(RC[-1] * PI() / 180) -> 0.70710678118654746
A11: =R[-1]C+5 -> 50 | B11: =SIN(RC[-1] * PI() / 180) -> 0.76604444311897801
A12: =R[-1]C+5 -> 55 | B12: =SIN(RC[-1] * PI() / 180) -> 0.8191520442889918
A13: =R[-1]C+5 -> 60 | B13: =SIN(RC[-1] * PI() / 180) -> 0.8660254037844386
A14: =R[-1]C+5 -> 65 | B14: =SIN(RC[-1] * PI() / 180) -> 0.90630778703664994
A15: =R[-1]C+5 -> 70 | B15: =SIN(RC[-1] * PI() / 180) -> 0.93969262078590832
A16: =R[-1]C+5 -> 75 | B16: =SIN(RC[-1] * PI() / 180) -> 0.96592582628906831
A17: =R[-1]C+5 -> 80 | B17: =SIN(RC[-1] * PI() / 180) -> 0.98480775301220802
A18: =R[-1]C+5 -> 85 | B18: =SIN(RC[-1] * PI() / 180) -> 0.99619469809174555
A19: =R[-1]C+5 -> 90 | B19: =SIN(RC[-1] * PI() / 180) -> 1
A20: =R[-1]C+5 -> 95 | B20: =SIN(RC[-1] * PI() / 180) -> 0.99619469809174555
A21: =R[-1]C+5 -> 100 | B21: =SIN(RC[-1] * PI() / 180) -> 0.98480775301220802
A22: =R[-1]C+5 -> 105 | B22: =SIN(RC[-1] * PI() / 180) -> 0.96592582628906831
A23: =R[-1]C+5 -> 110 | B23: =SIN(RC[-1] * PI() / 180) -> 0.93969262078590843
A24: =R[-1]C+5 -> 115 | B24: =SIN(RC[-1] * PI() / 180) -> 0.90630778703665005
A25: =R[-1]C+5 -> 120 | B25: =SIN(RC[-1] * PI() / 180) -> 0.86602540378443871
A26: =R[-1]C+5 -> 125 | B26: =SIN(RC[-1] * PI() / 180) -> 0.81915204428899202
A27: =R[-1]C+5 -> 130 | B27: =SIN(RC[-1] * PI() / 180) -> 0.76604444311897801
A28: =R[-1]C+5 -> 135 | B28: =SIN(RC[-1] * PI() / 180) -> 0.70710678118654757
A29: =R[-1]C+5 -> 140 | B29: =SIN(RC[-1] * PI() / 180) -> 0.64278760968653947
A30: =R[-1]C+5 -> 145 | B30: =SIN(RC[-1] * PI() / 180) -> 0.57357643635104638
A31: =R[-1]C+5 -> 150 | B31: =SIN(RC[-1] * PI() / 180) -> 0.49999999999999994
A32: =R[-1]C+5 -> 155 | B32: =SIN(RC[-1] * PI() / 180) -> 0.4226182617406995
A33: =R[-1]C+5 -> 160 | B33: =SIN(RC[-1] * PI() / 180) -> 0.34202014332566888
A34: =R[-1]C+5 -> 165 | B34: =SIN(RC[-1] * PI() / 180) -> 0.25881904510252102
A35: =R[-1]C+5 -> 170 | B35: =SIN(RC[-1] * PI() / 180) -> 0.17364817766693028
A36: =R[-1]C+5 -> 175 | B36: =SIN(RC[-1] * PI() / 180) -> 8.7155742747658638E-2
A37: =R[-1]C+5 -> 180 | B37: =SIN(RC[-1] * PI() / 180) -> 1.22514845490862E-16
A38: =R[-1]C+5 -> 185 | B38: =SIN(RC[-1] * PI() / 180) -> -8.7155742747657944E-2
A39: =R[-1]C+5 -> 190 | B39: =SIN(RC[-1] * PI() / 180) -> -0.17364817766693047
A40: =R[-1]C+5 -> 195 | B40: =SIN(RC[-1] * PI() / 180) -> -0.25881904510252035
A41: =R[-1]C+5 -> 200 | B41: =SIN(RC[-1] * PI() / 180) -> -0.34202014332566866
A42: =R[-1]C+5 -> 205 | B42: =SIN(RC[-1] * PI() / 180) -> -0.42261826174069927
A43: =R[-1]C+5 -> 210 | B43: =SIN(RC[-1] * PI() / 180) -> -0.50000000000000011
A44: =R[-1]C+5 -> 215 | B44: =SIN(RC[-1] * PI() / 180) -> -0.57357643635104583
A45: =R[-1]C+5 -> 220 | B45: =SIN(RC[-1] * PI() / 180) -> -0.64278760968653925
A46: =R[-1]C+5 -> 225 | B46: =SIN(RC[-1] * PI() / 180) -> -0.70710678118654746
A47: =R[-1]C+5 -> 230 | B47: =SIN(RC[-1] * PI() / 180) -> -0.7660444431189779
A48: =R[-1]C+5 -> 235 | B48: =SIN(RC[-1] * PI() / 180) -> -0.81915204428899158
A49: =R[-1]C+5 -> 240 | B49: =SIN(RC[-1] * PI() / 180) -> -0.86602540378443837
A50: =R[-1]C+5 -> 245 | B50: =SIN(RC[-1] * PI() / 180) -> -0.90630778703664971
A51: =R[-1]C+5 -> 250 | B51: =SIN(RC[-1] * PI() / 180) -> -0.93969262078590821
A52: =R[-1]C+5 -> 255 | B52: =SIN(RC[-1] * PI() / 180) -> -0.96592582628906831
A53: =R[-1]C+5 -> 260 | B53: =SIN(RC[-1] * PI() / 180) -> -0.98480775301220802
A54: =R[-1]C+5 -> 265 | B54: =SIN(RC[-1] * PI() / 180) -> -0.99619469809174555
A55: =R[-1]C+5 -> 270 | B55: =SIN(RC[-1] * PI() / 180) -> -1
A56: =R[-1]C+5 -> 275 | B56: =SIN(RC[-1] * PI() / 180) -> -0.99619469809174555
A57: =R[-1]C+5 -> 280 | B57: =SIN(RC[-1] * PI() / 180) -> -0.98480775301220813
A58: =R[-1]C+5 -> 285 | B58: =SIN(RC[-1] * PI() / 180) -> -0.9659258262890682
A59: =R[-1]C+5 -> 290 | B59: =SIN(RC[-1] * PI() / 180) -> -0.93969262078590854
A60: =R[-1]C+5 -> 295 | B60: =SIN(RC[-1] * PI() / 180) -> -0.90630778703664994
A61: =R[-1]C+5 -> 300 | B61: =SIN(RC[-1] * PI() / 180) -> -0.8660254037844386
A62: =R[-1]C+5 -> 305 | B62: =SIN(RC[-1] * PI() / 180) -> -0.8191520442889918
A63: =R[-1]C+5 -> 310 | B63: =SIN(RC[-1] * PI() / 180) -> -0.76604444311897812
A64: =R[-1]C+5 -> 315 | B64: =SIN(RC[-1] * PI() / 180) -> -0.70710678118654768
A65: =R[-1]C+5 -> 320 | B65: =SIN(RC[-1] * PI() / 180) -> -0.64278760968653958
A66: =R[-1]C+5 -> 325 | B66: =SIN(RC[-1] * PI() / 180) -> -0.57357643635104649
A67: =R[-1]C+5 -> 330 | B67: =SIN(RC[-1] * PI() / 180) -> -0.50000000000000044
A68: =R[-1]C+5 -> 335 | B68: =SIN(RC[-1] * PI() / 180) -> -0.4226182617407
A69: =R[-1]C+5 -> 340 | B69: =SIN(RC[-1] * PI() / 180) -> -0.3420201433256686
A70: =R[-1]C+5 -> 345 | B70: =SIN(RC[-1] * PI() / 180) -> -0.25881904510252068
A71: =R[-1]C+5 -> 350 | B71: =SIN(RC[-1] * PI() / 180) -> -0.17364817766693127
A72: =R[-1]C+5 -> 355 | B72: =SIN(RC[-1] * PI() / 180) -> -8.7155742747658319E-2
A73: =R[-1]C+5 -> 360 | B73: =SIN(RC[-1] * PI() / 180) -> -2.45029690981724E-16